subject_id,stimulus,stimulus_voice,face shown,stimulus_face,subject_response,actual_sentence,subject_response_unfixed
s054l2atjs,assets/list2/sounds/16.wav,indian,assets/list2/pictures/southasianlady3.png,south asian,he argue inconsistent,she argues with her sister,he argue inconsistent
s054l2atjs,assets/list2/sounds/112.wav,british,assets/list2/pictures/southasianlady3.png,south asian,the people had blamed her,the teapot is very hot,the people had blamed her
s054l2atjs,assets/list2/sounds/102.wav,british,assets/list2/pictures/southasianlady2.png,south asian,the good boy is equal to none,the football hit the goalpost,the good boy is equal to none
s054l2atjs,assets/list2/sounds/77.wav,indian,assets/list2/pictures/southasianlady3.png,south asian,he limp into the procedure,the milk is in a pitcher,he limp into the procedure
s054l2atjs,assets/list2/sounds/37.wav,american,assets/list2/pictures/whitelady2.png,white,the children are working home,the children are walking home,the children are working home
s054l2atjs,assets/list2/sounds/96.wav,american,assets/list2/pictures/southasianlady3.png,south asian,the baby is too large,the baby has blue eyes,the baby is too large
s054l2atjs,assets/list2/sounds/29.wav,american,assets/list2/pictures/southasianlady2.png,south asian,father forgot the bride,father forgot the bread,father forgot the bride
s054l2atjs,assets/list2/sounds/62.wav,indian,assets/list2/pictures/southasianlady3.png,south asian,he found the travel wayword,they found his brother hiding,he found the travel wayword
s054l2atjs,assets/list2/sounds/3.wav,indian,assets/list2/pictures/southasianlady3.png,south asian,the big done is lying in kennel,big dogs can be dangerous,the big done is lying in kennel
s054l2atjs,assets/list2/sounds/59.wav,british,assets/list2/pictures/whitelady2.png,white,the man is painting a sign,the man is painting a sign,the man is painting a sign
s054l2atjs,assets/list2/sounds/106.wav,british,assets/list2/pictures/southasianlady2.png,south asian,he finally said it,the firetruck is coming,he finally said it
s054l2atjs,assets/list2/sounds/1.wav,indian,assets/list2/pictures/southasianlady3.png,south asian,the boy has gone down the river,a boy fell from the window,the boy has gone down the river
s054l2atjs,assets/list2/sounds/118.wav,british,assets/list2/pictures/southasianlady3.png,south asian,he called an ambulance,they called an ambulance,he called an ambulance
s054l2atjs,assets/list2/sounds/50.wav,british,assets/list2/pictures/southasianlady2.png,south asian,the bucket fill up quickly,the buckets fill up quickly,the bucket fill up quickly
s054l2atjs,assets/list2/sounds/44.wav,british,assets/list2/pictures/southasianlady3.png,south asian,he rained for treatment,rain is good for trees,he rained for treatment
s054l2atjs,assets/list2/sounds/63.wav,indian,assets/list2/pictures/whitelady2.png,white,the dog played with the baby,the dog played with a stick,the dog played with the baby
s054l2atjs,assets/list2/sounds/57.wav,british,assets/list2/pictures/whitelady2.png,white,typical hair dress code,she took off her fur coat,typical hair dress code
s054l2atjs,assets/list2/sounds/87.wav,american,assets/list2/pictures/southasianlady3.png,south asian,he carry the trophy home back,they carried some shopping bags,he carry the trophy home back
s054l2atjs,assets/list2/sounds/79.wav,indian,assets/list2/pictures/southasianlady3.png,south asian,the tall man buy him shoe,the tall man tied his shoes,the tall man buy him shoe
s054l2atjs,assets/list2/sounds/32.wav,american,assets/list2/pictures/southasianlady3.png,south asian,the family bought a house,the family bought a house,the family bought a house
s054l2atjs,assets/list2/sounds/75.wav,indian,assets/list2/pictures/southasianlady3.png,south asian,the shoe travel the clothing,the shirts are in the closet,the shoe travel the clothing
s054l2atjs,assets/list2/sounds/78.wav,indian,assets/list2/pictures/whitelady2.png,white,he dropped him off the road,the truck drove up the road,he dropped him off the road
s054l2atjs,assets/list2/sounds/9.wav,indian,assets/list2/pictures/southasianlady2.png,south asian,the sister claimed at the dog,the picture came from a book,the sister claimed at the dog
s054l2atjs,assets/list2/sounds/107.wav,british,assets/list2/pictures/southasianlady2.png,south asian,the mother forgot a pone call,mother got a sauce pan,the mother forgot a pone call
s054l2atjs,assets/list2/sounds/61.wav,indian,assets/list2/pictures/whitelady2.png,white,he had a funny noise,they heard a funny noise,he had a funny noise
s054l2atjs,assets/list2/sounds/47.wav,british,assets/list2/pictures/whitelady2.png,white,the baby slapped old mother,the baby slept all night,the baby slapped old mother
s054l2atjs,assets/list2/sounds/69.wav,indian,assets/list2/pictures/whitelady2.png,white,he locked his celphone,she lost her credit card,he locked his celphone
s054l2atjs,assets/list2/sounds/53.wav,british,assets/list2/pictures/southasianlady2.png,south asian,the flowers can grow in a pot,flowers can grow in the pot,the flowers can grow in a pot
s054l2atjs,assets/list2/sounds/33.wav,american,assets/list2/pictures/southasianlady3.png,south asian,he mopped the ground,swimmers can hold their breath,he mopped the ground
s054l2atjs,assets/list2/sounds/5.wav,indian,assets/list2/pictures/whitelady2.png,white,he clear less the paper,the player lost a shoe,he clear less the paper
s054l2atjs,assets/list2/sounds/35.wav,american,assets/list2/pictures/whitelady2.png,white,they are pushing in old cars,they're pushing an old car,they are pushing in old cars
s054l2atjs,assets/list2/sounds/24.wav,american,assets/list2/pictures/southasianlady3.png,south asian,the cook is on the jail,her coat is on a chair,the cook is on the jail
s054l2atjs,assets/list2/sounds/104.wav,british,assets/list2/pictures/southasianlady3.png,south asian,she never buy his cure,sugar is very sweet,she never buy his cure
s054l2atjs,assets/list2/sounds/73.wav,indian,assets/list2/pictures/southasianlady2.png,south asian,he overviewed the maiden,the young people are dancing,he overviewed the maiden
s054l2atjs,assets/list2/sounds/117.wav,british,assets/list2/pictures/southasianlady3.png,south asian,the guy moved a near,the cow is milked every day,the guy moved a near
s054l2atjs,assets/list2/sounds/58.wav,british,assets/list2/pictures/southasianlady3.png,south asian,the match box is empty,the match boxes are empty,the match box is empty
s054l2atjs,assets/list2/sounds/30.wav,american,assets/list2/pictures/whitelady2.png,white,the road goes up the hill,the road goes up a hill,the road goes up the hill
s054l2atjs,assets/list2/sounds/82.wav,american,assets/list2/pictures/whitelady2.png,white,he had a typical table,mother cut the birthday cake,he had a typical table
s054l2atjs,assets/list2/sounds/68.wav,indian,assets/list2/pictures/whitelady2.png,white,the new order accompany the mother,the new road is on the map,the new order accompany the mother
s054l2atjs,assets/list2/sounds/39.wav,american,assets/list2/pictures/whitelady2.png,white,no causal apathy,milk comes in a carton,no causal apathy
s054l2atjs,assets/list2/sounds/28.wav,american,assets/list2/pictures/southasianlady3.png,south asian,the dog is in need of some meal,the dog is eating some meat,the dog is in need of some meal
s054l2atjs,assets/list2/sounds/115.wav,british,assets/list2/pictures/whitelady2.png,white,the girl is walking alone home,the girl is washing her hair,the girl is walking alone home
s054l2atjs,assets/list2/sounds/41.wav,british,assets/list2/pictures/whitelady2.png,white,the house had no bedroom,the house had nine bedrooms,the house had no bedroom
s054l2atjs,assets/list2/sounds/66.wav,indian,assets/list2/pictures/southasianlady3.png,south asian,he used to define his poor bed,the milk was by the front door,he used to define his poor bed
s054l2atjs,assets/list2/sounds/111.wav,british,assets/list2/pictures/southasianlady3.png,south asian,the waiter blocked the film,the waiter brought the cream,the waiter blocked the film
s054l2atjs,assets/list2/sounds/4.wav,indian,assets/list2/pictures/southasianlady2.png,south asian,his furious made him loose,the shoes were very dirty,his furious made him loose
s054l2atjs,assets/list2/sounds/49.wav,british,assets/list2/pictures/southasianlady2.png,south asian,chocolate windows the  way,the policemen know the way,chocolate windows the  way
s054l2atjs,assets/list2/sounds/42.wav,british,assets/list2/pictures/southasianlady2.png,south asian,they are shopping for school clothes,they're shopping for school clothes,they are shopping for school clothes
s054l2atjs,assets/list2/sounds/8.wav,indian,assets/list2/pictures/southasianlady3.png,south asian,he jumped from his own pot,she's drinking from her own cup,he jumped from his own pot
s054l2atjs,assets/list2/sounds/40.wav,american,assets/list2/pictures/southasianlady2.png,south asian,the dog script the busket,the dog sleeps in a basket,the dog script the busket
s054l2atjs,assets/list2/sounds/89.wav,american,assets/list2/pictures/southasianlady2.png,south asian,she is just cool for me,she uses her spoon to eat,she is just cool for me
s054l2atjs,assets/list2/sounds/22.wav,american,assets/list2/pictures/southasianlady2.png,south asian,the table has three legs,the table has three legs,the table has three legs
s054l2atjs,assets/list2/sounds/46.wav,british,assets/list2/pictures/southasianlady2.png,south asian,the child dying some fresh milk,the children drank some fresh milk,the child dying some fresh milk
s054l2atjs,assets/list2/sounds/110.wav,british,assets/list2/pictures/southasianlady2.png,south asian,the noise is bad comrade,the was a bad train wreck,the noise is bad comrade
s054l2atjs,assets/list2/sounds/38.wav,american,assets/list2/pictures/southasianlady2.png,south asian,they had two empty bottle,they had two empty bottles,they had two empty bottle
s054l2atjs,assets/list2/sounds/109.wav,british,assets/list2/pictures/whitelady2.png,white,the boy dropped the bettle,the ball broke the window,the boy dropped the bettle
s054l2atjs,assets/list2/sounds/34.wav,american,assets/list2/pictures/southasianlady3.png,south asian,he cut the stick with the knife,she cut the steak with her knife,he cut the stick with the knife
s054l2atjs,assets/list2/sounds/103.wav,british,assets/list2/pictures/southasianlady3.png,south asian,the boy run away from school,the boy ran away from school,the boy run away from school
s054l2atjs,assets/list2/sounds/97.wav,american,assets/list2/pictures/southasianlady3.png,south asian,the cardinal opened the shop,the bag fell off the shelf,the cardinal opened the shop
s054l2atjs,assets/list2/sounds/100.wav,american,assets/list2/pictures/whitelady2.png,white,he opened the window,they knocked on the window,he opened the window
s054l2atjs,assets/list2/sounds/108.wav,british,assets/list2/pictures/southasianlady2.png,south asian,he dig one piece of bottled,the baby wants his bottle,he dig one piece of bottled
s054l2atjs,assets/list2/sounds/65.wav,indian,assets/list2/pictures/southasianlady2.png,south asian,imagine our only job,the matches are on a shelf,imagine our only job
s054l2atjs,assets/list2/sounds/26.wav,american,assets/list2/pictures/whitelady2.png,white,its time to go to bed,it's time to go to bed,its time to go to bed
s054l2atjs,assets/list2/sounds/95.wav,american,assets/list2/pictures/southasianlady2.png,south asian,the person sit before the train,the bus leaves before the train,the person sit before the train
s054l2atjs,assets/list2/sounds/2.wav,indian,assets/list2/pictures/southasianlady3.png,south asian,the white whipped the face,the wife helped her husband,the white whipped the face
s054l2atjs,assets/list2/sounds/93.wav,american,assets/list2/pictures/southasianlady3.png,south asian,the dog is chasing the car,the dog is chasing the cat,the dog is chasing the car
s054l2atjs,assets/list2/sounds/7.wav,indian,assets/list2/pictures/whitelady2.png,white,the flower is aweful,the fire was very hot,the flower is aweful
s054l2atjs,assets/list2/sounds/14.wav,indian,assets/list2/pictures/southasianlady3.png,south asian,and i do not know who are you,the bananas are too ripe,and I do not know who are you
s054l2atjs,assets/list2/sounds/17.wav,indian,assets/list2/pictures/southasianlady3.png,south asian,the chicky window showed it all,the kitchen window was clean,the chicky window showed it all
s054l2atjs,assets/list2/sounds/105.wav,british,assets/list2/pictures/southasianlady3.png,south asian,the people are loughing,the two children are laughing,the people are loughing
s054l2atjs,assets/list2/sounds/27.wav,american,assets/list2/pictures/southasianlady2.png,south asian,mother rained the structures,mother read the instructions,mother rained the structures
s054l2atjs,assets/list2/sounds/13.wav,indian,assets/list2/pictures/southasianlady2.png,south asian,the family locked the coach,the family likes fish,the family locked the coach
s054l2atjs,assets/list2/sounds/12.wav,indian,assets/list2/pictures/southasianlady3.png,south asian,the family is locked,the towel fell on the floor,the family is locked
s054l2atjs,assets/list2/sounds/86.wav,american,assets/list2/pictures/whitelady2.png,white,the children had their teacher,the children helped their teacher,the children had their teacher
s054l2atjs,assets/list2/sounds/113.wav,british,assets/list2/pictures/whitelady2.png,white,he opened his good,the apple pie is good,he opened his good
s054l2atjs,assets/list2/sounds/45.wav,british,assets/list2/pictures/southasianlady3.png,south asian,they sat on a wooden bench,they sat on a wooden bench,they sat on a wooden bench
s054l2atjs,assets/list2/sounds/21.wav,american,assets/list2/pictures/southasianlady3.png,south asian,he found his path in the crowed,she found her purse in the trash,he found his path in the crowed
s054l2atjs,assets/list2/sounds/85.wav,american,assets/list2/pictures/southasianlady2.png,south asian,the children crawled the ground,the kitchen clock was wrong,the children crawled the ground
s054l2atjs,assets/list2/sounds/18.wav,indian,assets/list2/pictures/whitelady2.png,white,the ownwork decayed,he hung up his raincoat.,the ownwork decayed
s054l2atjs,assets/list2/sounds/99.wav,american,assets/list2/pictures/whitelady2.png,white,he worked in such potatoes,they wanted some potatoes,he worked in such potatoes
s054l2atjs,assets/list2/sounds/71.wav,indian,assets/list2/pictures/whitelady2.png,white,teh boy did the house chores,the boy did a handstand,teh boy did the house chores
s054l2atjs,assets/list2/sounds/31.wav,american,assets/list2/pictures/southasianlady2.png,south asian,the children uses a glass,the painter uses a brush,the children uses a glass
s054l2atjs,assets/list2/sounds/81.wav,american,assets/list2/pictures/whitelady2.png,white,the barber is very high,the ball bounced very high,the barber is very high
uo3yjbnds1,assets/list2/sounds/73.wav,indian,assets/list2/pictures/southasianlady2.png,south asian,the young people are something,the young people are dancing,the young people are something
uo3yjbnds1,assets/list2/sounds/82.wav,american,assets/list2/pictures/whitelady2.png,white,mother cut the birthday cake,mother cut the birthday cake,mother cut the birthday cake
uo3yjbnds1,assets/list2/sounds/91.wav,american,assets/list2/pictures/whitelady2.png,white,the running past the house,they're running past the house,the running past the house
uo3yjbnds1,assets/list2/sounds/106.wav,british,assets/list2/pictures/whitelady2.png,white,the fire,the firetruck is coming,the fire
uo3yjbnds1,assets/list2/sounds/11.wav,indian,assets/list2/pictures/southasianlady2.png,south asian,i have no idea,the paint dripped on the ground,I have no idea
uo3yjbnds1,assets/list2/sounds/110.wav,british,assets/list2/pictures/whitelady2.png,white,there was a bad cleanup,the was a bad train wreck,there was a bad cleanup
uo3yjbnds1,assets/list2/sounds/64.wav,indian,assets/list2/pictures/southasianlady3.png,south asian,the book fell over,the book tells a story,the book fell over
uo3yjbnds1,assets/list2/sounds/26.wav,american,assets/list2/pictures/whitelady2.png,white,its time to go to bed,it's time to go to bed,its time to go to bed
uo3yjbnds1,assets/list2/sounds/42.wav,british,assets/list2/pictures/southasianlady3.png,south asian,go shopping for school clothes,they're shopping for school clothes,go shopping for school clothes
uo3yjbnds1,assets/list2/sounds/105.wav,indian,assets/list2/pictures/southasianlady3.png,south asian,the people are falafels,the two children are laughing,the people are falafels
uo3yjbnds1,assets/list2/sounds/43.wav,british,assets/list2/pictures/whitelady2.png,white,air plane in the pack,they're playing in the park,air plane in the pack
uo3yjbnds1,assets/list2/sounds/77.wav,indian,assets/list2/pictures/southasianlady3.png,south asian,the moose is in a picture,the milk is in a pitcher,the moose is in a picture
uo3yjbnds1,assets/list2/sounds/6.wav,indian,assets/list2/pictures/southasianlady2.png,south asian,formal is a flipple,somebody stole the money,formal is a flipple
uo3yjbnds1,assets/list2/sounds/102.wav,indian,assets/list2/pictures/southasianlady3.png,south asian,the good boy gets a award,the football hit the goalpost,the good boy gets a award
uo3yjbnds1,assets/list2/sounds/94.wav,american,assets/list2/pictures/whitelady2.png,white,the milkman drives a small truck,the milkman drives a small truck,the milkman drives a small truck
uo3yjbnds1,assets/list2/sounds/58.wav,british,assets/list2/pictures/southasianlady3.png,south asian,the match almost,the match boxes are empty,the match almost
uo3yjbnds1,assets/list2/sounds/7.wav,indian,assets/list2/pictures/whitelady2.png,white,hallow is gimpy,the fire was very hot,hallow is gimpy
uo3yjbnds1,assets/list2/sounds/23.wav,american,assets/list2/pictures/whitelady2.png,white,the children wave at the train,the children waved at the train,the children wave at the train
uo3yjbnds1,assets/list2/sounds/31.wav,american,assets/list2/pictures/southasianlady2.png,south asian,the painter uses a brush,the painter uses a brush,the painter uses a brush
uo3yjbnds1,assets/list2/sounds/95.wav,american,assets/list2/pictures/whitelady2.png,white,the bus leaves before the train,the bus leaves before the train,the bus leaves before the train
uo3yjbnds1,assets/list2/sounds/68.wav,indian,assets/list2/pictures/southasianlady3.png,south asian,the new world is on the map,the new road is on the map,the new world is on the map
uo3yjbnds1,assets/list2/sounds/51.wav,british,assets/list2/pictures/southasianlady2.png,south asian,the bar is running away,the boy is running away,the bar is running away
uo3yjbnds1,assets/list2/sounds/15.wav,indian,assets/list2/pictures/southasianlady2.png,south asian,the debot is marduble,he grew lots of vegetables,the debot is marduble
uo3yjbnds1,assets/list2/sounds/4.wav,indian,assets/list2/pictures/whitelady2.png,white,the cam is debort,the shoes were very dirty,the cam is debort
uo3yjbnds1,assets/list2/sounds/3.wav,indian,assets/list2/pictures/whitelady2.png,white,big dog running away,big dogs can be dangerous,big dog running away
uo3yjbnds1,assets/list2/sounds/117.wav,british,assets/list2/pictures/southasianlady2.png,south asian,the guy is here every year,the cow is milked every day,the guy is here every year
uo3yjbnds1,assets/list2/sounds/69.wav,indian,assets/list2/pictures/whitelady2.png,white,he lost his credit card,she lost her credit card,he lost his credit card
uo3yjbnds1,assets/list2/sounds/24.wav,american,assets/list2/pictures/southasianlady2.png,south asian,her coat is on a chair,her coat is on a chair,her coat is on a chair
uo3yjbnds1,assets/list2/sounds/112.wav,british,assets/list2/pictures/southasianlady3.png,south asian,the debot is very hard,the teapot is very hot,the debot is very hard
uo3yjbnds1,assets/list2/sounds/40.wav,american,assets/list2/pictures/southasianlady2.png,south asian,the dog sleeps in a basket,the dog sleeps in a basket,the dog sleeps in a basket
uo3yjbnds1,assets/list2/sounds/83.wav,american,assets/list2/pictures/southasianlady2.png,south asian,the football game is over,the football game is over,the football game is over
uo3yjbnds1,assets/list2/sounds/10.wav,indian,assets/list2/pictures/southasianlady2.png,south asian,the guy is wearing flannel ,the car is going too fast,the guy is wearing flannel 
uo3yjbnds1,assets/list2/sounds/21.wav,american,assets/list2/pictures/southasianlady3.png,south asian,he found her purse in the trash,she found her purse in the trash,he found her purse in the trash
uo3yjbnds1,assets/list2/sounds/20.wav,indian,assets/list2/pictures/whitelady2.png,white,he might be memento,the mother heard the baby,he might be memento
uo3yjbnds1,assets/list2/sounds/9.wav,indian,assets/list2/pictures/southasianlady3.png,south asian,fist man is a build,the picture came from a book,fist man is a build
uo3yjbnds1,assets/list2/sounds/29.wav,american,assets/list2/pictures/whitelady2.png,white,father forgot the bread,father forgot the bread,father forgot the bread
uo3yjbnds1,assets/list2/sounds/104.wav,british,assets/list2/pictures/southasianlady2.png,south asian,children lacey ,sugar is very sweet,children lacey 
uo3yjbnds1,assets/list2/sounds/5.wav,indian,assets/list2/pictures/whitelady2.png,white,finet last feed,the player lost a shoe,finet last feed
uo3yjbnds1,assets/list2/sounds/101.wav,british,assets/list2/pictures/southasianlady2.png,south asian,old bed,school got out early today,old bed
uo3yjbnds1,assets/list2/sounds/25.wav,american,assets/list2/pictures/whitelady2.png,white,the girl is fixing her dress,the girl is fixing her dress,the girl is fixing her dress
uo3yjbnds1,assets/list2/sounds/74.wav,indian,assets/list2/pictures/southasianlady3.png,south asian,they needed a house,they waited for an hour,they needed a house
uo3yjbnds1,assets/list2/sounds/103.wav,british,assets/list2/pictures/southasianlady2.png,south asian,the boy ran away from school,the boy ran away from school,the boy ran away from school
uo3yjbnds1,assets/list2/sounds/96.wav,american,assets/list2/pictures/southasianlady2.png,south asian,the baby has blue eyes,the baby has blue eyes,the baby has blue eyes
uo3yjbnds1,assets/list2/sounds/99.wav,american,assets/list2/pictures/southasianlady3.png,south asian,they wanted some potatoes,they wanted some potatoes,they wanted some potatoes
uo3yjbnds1,assets/list2/sounds/27.wav,american,assets/list2/pictures/southasianlady2.png,south asian,mother read the instructions,mother read the instructions,mother read the instructions
uo3yjbnds1,assets/list2/sounds/80.wav,indian,assets/list2/pictures/southasianlady2.png,south asian,a letter fell on the floor,a letter fell on the floor,a letter fell on the floor
uo3yjbnds1,assets/list2/sounds/84.wav,american,assets/list2/pictures/southasianlady3.png,south asian,she stood near the window,she stood near the window,she stood near the window
uo3yjbnds1,assets/list2/sounds/71.wav,indian,assets/list2/pictures/southasianlady2.png,south asian,the boy did a handstand,the boy did a handstand,the boy did a handstand
uo3yjbnds1,assets/list2/sounds/37.wav,american,assets/list2/pictures/whitelady2.png,white,the children are walking home,the children are walking home,the children are walking home
uo3yjbnds1,assets/list2/sounds/1.wav,indian,assets/list2/pictures/southasianlady2.png,south asian,the boy treading through the snow,a boy fell from the window,the boy treading through the snow
uo3yjbnds1,assets/list2/sounds/35.wav,american,assets/list2/pictures/southasianlady2.png,south asian,there pushing an old car,they're pushing an old car,there pushing an old car
uo3yjbnds1,assets/list2/sounds/87.wav,american,assets/list2/pictures/whitelady2.png,white,they carried some shopping bags,they carried some shopping bags,they carried some shopping bags
uo3yjbnds1,assets/list2/sounds/60.wav,british,assets/list2/pictures/whitelady2.png,white,the dog came home at last,the dog came home at last,the dog came home at last
uo3yjbnds1,assets/list2/sounds/36.wav,american,assets/list2/pictures/whitelady2.png,white,the food is expensive,the food is expensive,the food is expensive
uo3yjbnds1,assets/list2/sounds/89.wav,american,assets/list2/pictures/southasianlady3.png,south asian,she uses her skill to eat,she uses her spoon to eat,she uses her skill to eat
uo3yjbnds1,assets/list2/sounds/111.wav,british,assets/list2/pictures/southasianlady2.png,south asian,the waiter robbed the queen,the waiter brought the cream,the waiter robbed the queen
uo3yjbnds1,assets/list2/sounds/79.wav,indian,assets/list2/pictures/southasianlady2.png,south asian,the toy man buy new shoes,the tall man tied his shoes,the toy man buy new shoes
uo3yjbnds1,assets/list2/sounds/70.wav,indian,assets/list2/pictures/southasianlady3.png,south asian,the dude was laying low,the team is playing well,the dude was laying low
uo3yjbnds1,assets/list2/sounds/86.wav,american,assets/list2/pictures/whitelady2.png,white,the children helped their teacher,the children helped their teacher,the children helped their teacher
uo3yjbnds1,assets/list2/sounds/19.wav,indian,assets/list2/pictures/whitelady2.png,white,the mailman ruffled,the mailman brought a letter,the mailman ruffled
uo3yjbnds1,assets/list2/sounds/65.wav,indian,assets/list2/pictures/southasianlady3.png,south asian,the matches are on a shelf,the matches are on a shelf,the matches are on a shelf
uo3yjbnds1,assets/list2/sounds/18.wav,indian,assets/list2/pictures/southasianlady3.png,south asian,honey hops are rangers,he hung up his raincoat.,honey hops are rangers
uo3yjbnds1,assets/list2/sounds/56.wav,british,assets/list2/pictures/southasianlady3.png,south asian,the lady washed the ship,the lady washed the shirt,the lady washed the ship
uo3yjbnds1,assets/list2/sounds/85.wav,american,assets/list2/pictures/southasianlady2.png,south asian,the kitchen clock was wrong,the kitchen clock was wrong,the kitchen clock was wrong
