subject_id,stimulus,stimulus_voice,face shown,stimulus_face,subject_response,actual_sentence,subject_response_unfixed
d03h29g3vc,assets/list1/sounds/4.wav,american,assets/list1/pictures/southasianlady1.png,south asian,the shoes were very dirty,the shoes were very dirty,the shoes were very dirty
d03h29g3vc,assets/list1/sounds/87.wav,british,assets/list1/pictures/southasianlady1.png,south asian,had shopping bags,they carried some shopping bags,had shopping bags
d03h29g3vc,assets/list1/sounds/42.wav,indian,assets/list1/pictures/whitelady1.png,white,,they're shopping for school clothes,
d03h29g3vc,assets/list1/sounds/48.wav,indian,assets/list1/pictures/whitelady1.png,white,,the salt shaker is empty,
d03h29g3vc,assets/list1/sounds/52.wav,indian,assets/list1/pictures/whitelady3.png,white,the ,a towel is near the sink,the 
d03h29g3vc,assets/list1/sounds/18.wav,american,assets/list1/pictures/southasianlady1.png,south asian,he hung up his raincoat,he hung up his raincoat.,he hung up his raincoat
d03h29g3vc,assets/list1/sounds/75.wav,american,assets/list1/pictures/whitelady3.png,white,the shirts are in the ,the shirts are in the closet,the shirts are in the 
d03h29g3vc,assets/list1/sounds/51.wav,indian,assets/list1/pictures/whitelady3.png,white,the boy,the boy is running away,the boy
d03h29g3vc,assets/list1/sounds/5.wav,american,assets/list1/pictures/whitelady1.png,white,the player lost the shoot,the player lost a shoe,the player lost the shoot
d03h29g3vc,assets/list1/sounds/112.wav,indian,assets/list1/pictures/whitelady1.png,white,very,the teapot is very hot,very
d03h29g3vc,assets/list1/sounds/102.wav,indian,assets/list1/pictures/southasianlady1.png,south asian,difficult,the football hit the goalpost,difficult
d03h29g3vc,assets/list1/sounds/65.wav,american,assets/list1/pictures/whitelady3.png,white,the matches are on a shelf,the matches are on a shelf,the matches are on a shelf
d03h29g3vc,assets/list1/sounds/66.wav,american,assets/list1/pictures/whitelady1.png,white,the milk was by the front door,the milk was by the front door,the milk was by the front door
d03h29g3vc,assets/list1/sounds/70.wav,american,assets/list1/pictures/southasianlady1.png,south asian,the team's playing well,the team is playing well,the team's playing well
d03h29g3vc,assets/list1/sounds/113.wav,indian,assets/list1/pictures/whitelady3.png,white,,the apple pie is good,
d03h29g3vc,assets/list1/sounds/88.wav,british,assets/list1/pictures/southasianlady1.png,south asian,someone is crossing the road,someone is crossing the road,someone is crossing the road
d03h29g3vc,assets/list1/sounds/67.wav,american,assets/list1/pictures/southasianlady1.png,south asian,the broom was in the corner,the broom was in the corner,the broom was in the corner
d03h29g3vc,assets/list1/sounds/40.wav,british,assets/list1/pictures/southasianlady1.png,south asian,using a basket,the dog sleeps in a basket,using a basket
d03h29g3vc,assets/list1/sounds/69.wav,american,assets/list1/pictures/southasianlady1.png,south asian,she lost her credit card,she lost her credit card,she lost her credit card
d03h29g3vc,assets/list1/sounds/57.wav,indian,assets/list1/pictures/southasianlady1.png,south asian,,she took off her fur coat,
d03h29g3vc,assets/list1/sounds/89.wav,british,assets/list1/pictures/whitelady3.png,white,she uses her,she uses her spoon to eat,she uses her
d03h29g3vc,assets/list1/sounds/59.wav,indian,assets/list1/pictures/southasianlady1.png,south asian,,the man is painting a sign,
d03h29g3vc,assets/list1/sounds/74.wav,american,assets/list1/pictures/southasianlady1.png,south asian,he waited for an hour,they waited for an hour,he waited for an hour
d03h29g3vc,assets/list1/sounds/7.wav,american,assets/list1/pictures/whitelady1.png,white,the fire was very hot,the fire was very hot,the fire was very hot
d03h29g3vc,assets/list1/sounds/1.wav,american,assets/list1/pictures/whitelady1.png,white,a boy fell from the window,a boy fell from the window,a boy fell from the window
d03h29g3vc,assets/list1/sounds/71.wav,american,assets/list1/pictures/southasianlady1.png,south asian,the boy did a handstand,the boy did a handstand,the boy did a handstand
d03h29g3vc,assets/list1/sounds/64.wav,american,assets/list1/pictures/whitelady3.png,white,the book tells a story,the book tells a story,the book tells a story
d03h29g3vc,assets/list1/sounds/115.wav,indian,assets/list1/pictures/southasianlady1.png,south asian,the girl is washing her hair,the girl is washing her hair,the girl is washing her hair
d03h29g3vc,assets/list1/sounds/78.wav,american,assets/list1/pictures/whitelady1.png,white,the truck drove up the road,the truck drove up the road,the truck drove up the road
d03h29g3vc,assets/list1/sounds/85.wav,british,assets/list1/pictures/whitelady1.png,white,the kitchen clock was wrong,the kitchen clock was wrong,the kitchen clock was wrong
d03h29g3vc,assets/list1/sounds/76.wav,american,assets/list1/pictures/whitelady1.png,white,he watched a scary movie,they watched the scary movie,he watched a scary movie
d03h29g3vc,assets/list1/sounds/62.wav,american,assets/list1/pictures/whitelady1.png,white,they found his brother hiding,they found his brother hiding,they found his brother hiding
d03h29g3vc,assets/list1/sounds/77.wav,american,assets/list1/pictures/whitelady3.png,white,is in the pitcher,the milk is in a pitcher,is in the pitcher
d03h29g3vc,assets/list1/sounds/34.wav,british,assets/list1/pictures/southasianlady1.png,south asian,she got stabbed with a knife,she cut the steak with her knife,she got stabbed with a knife
d03h29g3vc,assets/list1/sounds/15.wav,american,assets/list1/pictures/southasianlady1.png,south asian,he grew lots of vegetables,he grew lots of vegetables,he grew lots of vegetables
d03h29g3vc,assets/list1/sounds/92.wav,british,assets/list1/pictures/southasianlady1.png,south asian,he is washing his with soap,he's washing his face with soap,he is washing his with soap
d03h29g3vc,assets/list1/sounds/96.wav,british,assets/list1/pictures/southasianlady1.png,south asian,blue eyes,the baby has blue eyes,blue eyes
d03h29g3vc,assets/list1/sounds/8.wav,american,assets/list1/pictures/whitelady3.png,white,she is drinking from her own cup,she's drinking from her own cup,she is drinking from her own cup
d03h29g3vc,assets/list1/sounds/104.wav,indian,assets/list1/pictures/southasianlady1.png,south asian,,sugar is very sweet,
d03h29g3vc,assets/list1/sounds/118.wav,indian,assets/list1/pictures/whitelady3.png,white,,they called an ambulance,
d03h29g3vc,assets/list1/sounds/6.wav,american,assets/list1/pictures/southasianlady1.png,south asian,somebody stole the money,somebody stole the money,somebody stole the money
d03h29g3vc,assets/list1/sounds/12.wav,american,assets/list1/pictures/whitelady1.png,white,the cow fell on the floor,the towel fell on the floor,the cow fell on the floor
d03h29g3vc,assets/list1/sounds/11.wav,american,assets/list1/pictures/whitelady1.png,white,the paint dripped on the ground,the paint dripped on the ground,the paint dripped on the ground
d03h29g3vc,assets/list1/sounds/98.wav,british,assets/list1/pictures/southasianlady1.png,south asian,they are coming,they are coming for dinner,they are coming
d03h29g3vc,assets/list1/sounds/23.wav,british,assets/list1/pictures/southasianlady1.png,south asian,the tre,the children waved at the train,the tre
d03h29g3vc,assets/list1/sounds/44.wav,indian,assets/list1/pictures/whitelady1.png,white,,rain is good for trees,
d03h29g3vc,assets/list1/sounds/26.wav,british,assets/list1/pictures/whitelady1.png,white,it is time to go to bed,it's time to go to bed,it is time to go to bed
d03h29g3vc,assets/list1/sounds/53.wav,indian,assets/list1/pictures/whitelady3.png,white,,flowers can grow in the pot,
d03h29g3vc,assets/list1/sounds/83.wav,british,assets/list1/pictures/whitelady1.png,white,,the football game is over,
d03h29g3vc,assets/list1/sounds/90.wav,british,assets/list1/pictures/whitelady1.png,white,the cat lay on ,the cat lay on the bed,the cat lay on 
d03h29g3vc,assets/list1/sounds/117.wav,indian,assets/list1/pictures/whitelady1.png,white,,the cow is milked every day,
d03h29g3vc,assets/list1/sounds/50.wav,indian,assets/list1/pictures/whitelady1.png,white,,the buckets fill up quickly,
d03h29g3vc,assets/list1/sounds/61.wav,american,assets/list1/pictures/whitelady3.png,white,they heard a funny noise,they heard a funny noise,they heard a funny noise
d03h29g3vc,assets/list1/sounds/108.wav,indian,assets/list1/pictures/whitelady3.png,white,the baby lost his walker,the baby wants his bottle,the baby lost his walker
d03h29g3vc,assets/list1/sounds/55.wav,indian,assets/list1/pictures/southasianlady1.png,south asian,the,the janitor swept the floor,the
d03h29g3vc,assets/list1/sounds/86.wav,british,assets/list1/pictures/whitelady1.png,white,the students helped their teacher,the children helped their teacher,the students helped their teacher
d03h29g3vc,assets/list1/sounds/80.wav,american,assets/list1/pictures/southasianlady1.png,south asian,a letter fell on the floor,a letter fell on the floor,a letter fell on the floor
d03h29g3vc,assets/list1/sounds/2.wav,american,assets/list1/pictures/southasianlady1.png,south asian,the wife helps her husband,the wife helped her husband,the wife helps her husband
d03h29g3vc,assets/list1/sounds/99.wav,british,assets/list1/pictures/southasianlady1.png,south asian,they are watching some,they wanted some potatoes,they are watching some
d03h29g3vc,assets/list1/sounds/97.wav,british,assets/list1/pictures/whitelady1.png,white,the bag is now on the shelf,the bag fell off the shelf,the bag is now on the shelf
d03h29g3vc,assets/list1/sounds/41.wav,indian,assets/list1/pictures/whitelady1.png,white,the house had nine bedrooms,the house had nine bedrooms,the house had nine bedrooms
d03h29g3vc,assets/list1/sounds/10.wav,american,assets/list1/pictures/whitelady3.png,white,the car is going too fast,the car is going too fast,the car is going too fast
d03h29g3vc,assets/list1/sounds/103.wav,indian,assets/list1/pictures/whitelady1.png,white,the boy ran away from school,the boy ran away from school,the boy ran away from school
d03h29g3vc,assets/list1/sounds/114.wav,indian,assets/list1/pictures/southasianlady1.png,south asian,the jar was,the jelly jar was full,the jar was
d03h29g3vc,assets/list1/sounds/72.wav,american,assets/list1/pictures/whitelady3.png,white,they took some food outside,they took some food outside,they took some food outside
d03h29g3vc,assets/list1/sounds/9.wav,american,assets/list1/pictures/southasianlady1.png,south asian,the picture came from a book,the picture came from a book,the picture came from a book
d03h29g3vc,assets/list1/sounds/95.wav,british,assets/list1/pictures/whitelady3.png,white,train,the bus leaves before the train,train
d03h29g3vc,assets/list1/sounds/30.wav,british,assets/list1/pictures/whitelady3.png,white,the road goes up the hill,the road goes up a hill,the road goes up the hill
jx4vv82pev,assets/list2/sounds/48.wav,british,assets/list2/pictures/whitelady2.png,white,the salt shaker is empty,the salt shaker is empty,the salt shaker is empty
jx4vv82pev,assets/list2/sounds/105.wav,british,assets/list2/pictures/whitelady2.png,white,the vigile is alive,the two children are laughing,the vigile is alive
jx4vv82pev,assets/list2/sounds/26.wav,american,assets/list2/pictures/southasianlady3.png,south asian,it's time to go to bed,it's time to go to bed,it's time to go to bed
jx4vv82pev,assets/list2/sounds/24.wav,american,assets/list2/pictures/southasianlady3.png,south asian,her coat is on a chair,her coat is on a chair,her coat is on a chair
jx4vv82pev,assets/list2/sounds/115.wav,british,assets/list2/pictures/whitelady2.png,white,the girl is washing her hair,the girl is washing her hair,the girl is washing her hair
jx4vv82pev,assets/list2/sounds/36.wav,american,assets/list2/pictures/southasianlady2.png,south asian,the food is expensive,the food is expensive,the food is expensive
jx4vv82pev,assets/list2/sounds/77.wav,indian,assets/list2/pictures/whitelady2.png,white,the milk is in a pitcher,the milk is in a pitcher,the milk is in a pitcher
jx4vv82pev,assets/list2/sounds/1.wav,indian,assets/list2/pictures/southasianlady3.png,south asian,the boy said some more than others,a boy fell from the window,the boy said some more than others
jx4vv82pev,assets/list2/sounds/53.wav,british,assets/list2/pictures/southasianlady3.png,south asian,flowers can grow in a pot,flowers can grow in the pot,flowers can grow in a pot
jx4vv82pev,assets/list2/sounds/109.wav,british,assets/list2/pictures/whitelady2.png,white,the boy grew up feeling low,the ball broke the window,the boy grew up feeling low
jx4vv82pev,assets/list2/sounds/98.wav,american,assets/list2/pictures/southasianlady3.png,south asian,they are coming for dinner,they are coming for dinner,they are coming for dinner
jx4vv82pev,assets/list2/sounds/90.wav,american,assets/list2/pictures/southasianlady2.png,south asian,the cat lay on the bed,the cat lay on the bed,the cat lay on the bed
jx4vv82pev,assets/list2/sounds/81.wav,american,assets/list2/pictures/southasianlady3.png,south asian,the ball bounced very high,the ball bounced very high,the ball bounced very high
jx4vv82pev,assets/list2/sounds/75.wav,indian,assets/list2/pictures/southasianlady3.png,south asian,the shirts are in the closet,the shirts are in the closet,the shirts are in the closet
jx4vv82pev,assets/list2/sounds/95.wav,american,assets/list2/pictures/whitelady2.png,white,the bus leaves before the train,the bus leaves before the train,the bus leaves before the train
jx4vv82pev,assets/list2/sounds/46.wav,british,assets/list2/pictures/southasianlady2.png,south asian,the child drank some fresh milk,the children drank some fresh milk,the child drank some fresh milk
jx4vv82pev,assets/list2/sounds/120.wav,british,assets/list2/pictures/southasianlady2.png,south asian,he climbed up a ladder,he climbed up the ladder,he climbed up a ladder
jx4vv82pev,assets/list2/sounds/47.wav,british,assets/list2/pictures/southasianlady3.png,south asian,the baby slept all night,the baby slept all night,the baby slept all night
jx4vv82pev,assets/list2/sounds/89.wav,american,assets/list2/pictures/whitelady2.png,white,she uses her spoon to eat,she uses her spoon to eat,she uses her spoon to eat
jx4vv82pev,assets/list2/sounds/79.wav,indian,assets/list2/pictures/southasianlady2.png,south asian,the man dyed his shoes,the tall man tied his shoes,the man dyed his shoes
jx4vv82pev,assets/list2/sounds/2.wav,indian,assets/list2/pictures/whitelady2.png,white,the wife egged her husband,the wife helped her husband,the wife egged her husband
jx4vv82pev,assets/list2/sounds/59.wav,british,assets/list2/pictures/southasianlady3.png,south asian,the man is painting a sign,the man is painting a sign,the man is painting a sign
jx4vv82pev,assets/list2/sounds/108.wav,british,assets/list2/pictures/southasianlady3.png,south asian,the baby wants his bottle,the baby wants his bottle,the baby wants his bottle
jx4vv82pev,assets/list2/sounds/80.wav,indian,assets/list2/pictures/southasianlady3.png,south asian,a letter fell on the floor,a letter fell on the floor,a letter fell on the floor
jx4vv82pev,assets/list2/sounds/21.wav,american,assets/list2/pictures/whitelady2.png,white,she found her purse in the trash,she found her purse in the trash,she found her purse in the trash
jx4vv82pev,assets/list2/sounds/71.wav,indian,assets/list2/pictures/southasianlady2.png,south asian,the boy did a handstand,the boy did a handstand,the boy did a handstand
jx4vv82pev,assets/list2/sounds/88.wav,american,assets/list2/pictures/whitelady2.png,white,someone is crossing the road,someone is crossing the road,someone is crossing the road
jx4vv82pev,assets/list2/sounds/18.wav,indian,assets/list2/pictures/southasianlady3.png,south asian,the longlost is in,he hung up his raincoat.,the longlost is in
jx4vv82pev,assets/list2/sounds/5.wav,indian,assets/list2/pictures/southasianlady2.png,south asian,,the player lost a shoe,
jx4vv82pev,assets/list2/sounds/27.wav,american,assets/list2/pictures/southasianlady3.png,south asian,mother read the instructions,mother read the instructions,mother read the instructions
jx4vv82pev,assets/list2/sounds/69.wav,indian,assets/list2/pictures/whitelady2.png,white,she lost her credit card,she lost her credit card,she lost her credit card
jx4vv82pev,assets/list2/sounds/111.wav,british,assets/list2/pictures/southasianlady3.png,south asian,the refill robbed the key,the waiter brought the cream,the refill robbed the key
jx4vv82pev,assets/list2/sounds/93.wav,american,assets/list2/pictures/southasianlady2.png,south asian,the dog is chasing the car,the dog is chasing the cat,the dog is chasing the car
jx4vv82pev,assets/list2/sounds/60.wav,british,assets/list2/pictures/southasianlady2.png,south asian,the dog came home atlast,the dog came home at last,the dog came home atlast
jx4vv82pev,assets/list2/sounds/50.wav,british,assets/list2/pictures/whitelady2.png,white,the backherds flew up quickly,the buckets fill up quickly,the backherds flew up quickly
jx4vv82pev,assets/list2/sounds/35.wav,american,assets/list2/pictures/whitelady2.png,white,they're pushing an old car,they're pushing an old car,they're pushing an old car
jx4vv82pev,assets/list2/sounds/61.wav,indian,assets/list2/pictures/southasianlady2.png,south asian,they heard a funny noise,they heard a funny noise,they heard a funny noise
jx4vv82pev,assets/list2/sounds/22.wav,american,assets/list2/pictures/whitelady2.png,white,the table has three legs,the table has three legs,the table has three legs
jx4vv82pev,assets/list2/sounds/62.wav,indian,assets/list2/pictures/southasianlady3.png,south asian,they found his brother hidding,they found his brother hiding,they found his brother hidding
jx4vv82pev,assets/list2/sounds/58.wav,british,assets/list2/pictures/southasianlady3.png,south asian,the match boxes are empty,the match boxes are empty,the match boxes are empty
jx4vv82pev,assets/list2/sounds/31.wav,american,assets/list2/pictures/southasianlady2.png,south asian,the painter uses a brush,the painter uses a brush,the painter uses a brush
jx4vv82pev,assets/list2/sounds/7.wav,indian,assets/list2/pictures/whitelady2.png,white,the child is getting drunk,the fire was very hot,the child is getting drunk
jx4vv82pev,assets/list2/sounds/92.wav,american,assets/list2/pictures/southasianlady3.png,south asian,he's washing his face with soap,he's washing his face with soap,he's washing his face with soap
jx4vv82pev,assets/list2/sounds/96.wav,american,assets/list2/pictures/southasianlady3.png,south asian,the baby has blue eyes,the baby has blue eyes,the baby has blue eyes
jx4vv82pev,assets/list2/sounds/68.wav,indian,assets/list2/pictures/whitelady2.png,white,the new ruled is on the map,the new road is on the map,the new ruled is on the map
jx4vv82pev,assets/list2/sounds/83.wav,american,assets/list2/pictures/southasianlady2.png,south asian,the football game is over,the football game is over,the football game is over
jx4vv82pev,assets/list2/sounds/87.wav,american,assets/list2/pictures/southasianlady2.png,south asian,they carried some shopping bags,they carried some shopping bags,they carried some shopping bags
jx4vv82pev,assets/list2/sounds/74.wav,indian,assets/list2/pictures/whitelady2.png,white,they waited for an 'r',they waited for an hour,they waited for an 'r'
jx4vv82pev,assets/list2/sounds/4.wav,indian,assets/list2/pictures/southasianlady2.png,south asian,in white deli,the shoes were very dirty,in white deli
jx4vv82pev,assets/list2/sounds/72.wav,indian,assets/list2/pictures/whitelady2.png,white,is cold outside,they took some food outside,is cold outside
jx4vv82pev,assets/list2/sounds/3.wav,indian,assets/list2/pictures/whitelady2.png,white,the big dog climbed on you,big dogs can be dangerous,the big dog climbed on you
jx4vv82pev,assets/list2/sounds/119.wav,british,assets/list2/pictures/whitelady2.png,white,we are drinking water,they are drinking coffee,we are drinking water
jx4vv82pev,assets/list2/sounds/67.wav,indian,assets/list2/pictures/whitelady2.png,white,the boy was in the corner,the broom was in the corner,the boy was in the corner
jx4vv82pev,assets/list2/sounds/14.wav,indian,assets/list2/pictures/southasianlady2.png,south asian,the bananas are all ripe,the bananas are too ripe,the bananas are all ripe
jx4vv82pev,assets/list2/sounds/114.wav,british,assets/list2/pictures/whitelady2.png,white,the jelly jar was full,the jelly jar was full,the jelly jar was full
jx4vv82pev,assets/list2/sounds/33.wav,american,assets/list2/pictures/southasianlady3.png,south asian,swimmers can hold their breath,swimmers can hold their breath,swimmers can hold their breath
jx4vv82pev,assets/list2/sounds/23.wav,american,assets/list2/pictures/whitelady2.png,white,the children waived at the train,the children waved at the train,the children waived at the train
jx4vv82pev,assets/list2/sounds/66.wav,indian,assets/list2/pictures/whitelady2.png,white,the milk was by the front door,the milk was by the front door,the milk was by the front door
jx4vv82pev,assets/list2/sounds/57.wav,british,assets/list2/pictures/whitelady2.png,white,she took off her fur coat,she took off her fur coat,she took off her fur coat
jx4vv82pev,assets/list2/sounds/37.wav,american,assets/list2/pictures/whitelady2.png,white,the children are walking home,the children are walking home,the children are walking home
jx4vv82pev,assets/list2/sounds/16.wav,indian,assets/list2/pictures/southasianlady3.png,south asian,,she argues with her sister,
jx4vv82pev,assets/list2/sounds/28.wav,american,assets/list2/pictures/whitelady2.png,white,the dog is eating some meat,the dog is eating some meat,the dog is eating some meat
jx4vv82pev,assets/list2/sounds/99.wav,american,assets/list2/pictures/southasianlady3.png,south asian,they wanted some potatoes,they wanted some potatoes,they wanted some potatoes
jx4vv82pev,assets/list2/sounds/40.wav,american,assets/list2/pictures/whitelady2.png,white,the dog sleeps in a basket,the dog sleeps in a basket,the dog sleeps in a basket
jx4vv82pev,assets/list2/sounds/94.wav,american,assets/list2/pictures/southasianlady2.png,south asian,the milkman drives a small truck,the milkman drives a small truck,the milkman drives a small truck
jx4vv82pev,assets/list2/sounds/42.wav,british,assets/list2/pictures/whitelady2.png,white,they're shopping for school clothes,they're shopping for school clothes,they're shopping for school clothes
jx4vv82pev,assets/list2/sounds/9.wav,indian,assets/list2/pictures/whitelady2.png,white,,the picture came from a book,
jx4vv82pev,assets/list2/sounds/12.wav,indian,assets/list2/pictures/southasianlady3.png,south asian,the child is home,the towel fell on the floor,the child is home
jx4vv82pev,assets/list2/sounds/65.wav,indian,assets/list2/pictures/southasianlady3.png,south asian,the matches are on the counter,the matches are on a shelf,the matches are on the counter
jx4vv82pev,assets/list2/sounds/56.wav,british,assets/list2/pictures/southasianlady2.png,south asian,the lady washed the shirt,the lady washed the shirt,the lady washed the shirt
jx4vv82pev,assets/list2/sounds/113.wav,british,assets/list2/pictures/whitelady2.png,white,the applefry is good,the apple pie is good,the applefry is good
jx4vv82pev,assets/list2/sounds/73.wav,indian,assets/list2/pictures/whitelady2.png,white,the young people are matching,the young people are dancing,the young people are matching
jx4vv82pev,assets/list2/sounds/112.wav,british,assets/list2/pictures/southasianlady2.png,south asian,the people are just very hot,the teapot is very hot,the people are just very hot
jx4vv82pev,assets/list2/sounds/117.wav,british,assets/list2/pictures/southasianlady3.png,south asian,the guy with milk every year,the cow is milked every day,the guy with milk every year
jx4vv82pev,assets/list2/sounds/116.wav,british,assets/list2/pictures/southasianlady3.png,south asian,the girl played with a baby,the girl played with the baby,the girl played with a baby
jx4vv82pev,assets/list2/sounds/45.wav,british,assets/list2/pictures/whitelady2.png,white,they sat on a wooden bench,they sat on a wooden bench,they sat on a wooden bench
jx4vv82pev,assets/list2/sounds/38.wav,american,assets/list2/pictures/southasianlady2.png,south asian,they had two empty bottles,they had two empty bottles,they had two empty bottles
jx4vv82pev,assets/list2/sounds/102.wav,british,assets/list2/pictures/southasianlady2.png,south asian,the good boy hit the goalpost,the football hit the goalpost,the good boy hit the goalpost
jx4vv82pev,assets/list2/sounds/30.wav,american,assets/list2/pictures/southasianlady3.png,south asian,the road goes up the hill,the road goes up a hill,the road goes up the hill
jx4vv82pev,assets/list2/sounds/78.wav,indian,assets/list2/pictures/southasianlady3.png,south asian,the trash rolled up the road,the truck drove up the road,the trash rolled up the road
jx4vv82pev,assets/list2/sounds/63.wav,indian,assets/list2/pictures/whitelady2.png,white,the dog played with a stick,the dog played with a stick,the dog played with a stick
jx4vv82pev,assets/list2/sounds/17.wav,indian,assets/list2/pictures/whitelady2.png,white,the kitchen in the racoon,the kitchen window was clean,the kitchen in the racoon
jx4vv82pev,assets/list2/sounds/107.wav,british,assets/list2/pictures/southasianlady3.png,south asian,mother got the carplane,mother got a sauce pan,mother got the carplane
jx4vv82pev,assets/list2/sounds/8.wav,indian,assets/list2/pictures/whitelady2.png,white,from her own,she's drinking from her own cup,from her own
jx4vv82pev,assets/list2/sounds/41.wav,british,assets/list2/pictures/southasianlady3.png,south asian,the house had nine bed rooms,the house had nine bedrooms,the house had nine bed rooms
jx4vv82pev,assets/list2/sounds/25.wav,american,assets/list2/pictures/whitelady2.png,white,the girl is fixing her dress,the girl is fixing her dress,the girl is fixing her dress
